{
  "object": "election",
  "action": "setup",
  "id": "ZVxXK2QN60uCNxNsIzShYYQmtwGttWLpQPQapYCNg4g=",
  "lao": "p_EYbHyMv6sopI5QhEXBf40MO_eNoq7V_LygBd4c9RA=",
  "name": "NewElection",
  "version": "1.0.0",
  "created_at": 1633098941,
  "start_time": 1633098941,
  "end_time": 1633099812,
  "questions": [
    {
      "id": "k0RvqQHCELFjr2RxgUWRmq2tDb6koGs2MhYr5D5PAoU=",
      "question": "Where to go out?",
      "voting_method": "Plurality",
      "ballot_options": ["Bar", "Club", "Restaurant"],
      "write_in": false
    }
  ]
}
